{"authority":{"edition_admission":false,"editorial_selection":false,"house_release":false,"publication":false},"candidate_id":"manga-sequence:ad8b69b2fa56d8cf7b8a9a589411c5a393f44e83dc416a47cf5875ef8340a4ee","laws":["REORDER != SOURCE MUTATION","ORDER != ANCESTRY","READING ORDER != OWNERSHIP","SEQUENCE != ADMISSION","OMISSION != DELETION","DUPLICATION != NEW SOURCE","SLOT != PAGE IDENTITY","CANDIDATE != ISSUE"],"parents":[{"kind":"page","parent_id":"drive:17SVY1L0VJ_7Q6ROY5vidmLCMUuXxNzfH","title":"Rosemary Violet Home"},{"kind":"page","parent_id":"witness:home-grows-open-001:small-things-grow","title":"Fidelity Friday — Small Things Grow"},{"kind":"page","parent_id":"witness:home-grows-open-001:last-light-open-circuit","title":"Last Light / Open Circuit"},{"kind":"candidate","parent_id":"witness:home-grows-open-001:remix-candidate","title":"HOME GROWS OPEN remix candidate"}],"schema":"lemonpress/manga-sequence-candidate/v0","sequence_id":"home-grows-open-sequence-001","sequence_sha256":"787abf611522fbf821c14f3294900b81395f14f112d5ba834f1fe7a7f01de08c","slots":[{"selection":{"kind":"whole"},"slot":1,"source_ref":"drive:17SVY1L0VJ_7Q6ROY5vidmLCMUuXxNzfH"},{"selection":{"kind":"whole"},"slot":2,"source_ref":"witness:home-grows-open-001:small-things-grow"},{"selection":{"kind":"whole"},"slot":3,"source_ref":"witness:home-grows-open-001:last-light-open-circuit"},{"selection":{"kind":"whole"},"slot":4,"source_ref":"witness:home-grows-open-001:remix-candidate"}],"status":"CANDIDATE","title":"HOME GROWS OPEN — Sequence 001","wrench":{"INPUT":[{"kind":"page","parent_id":"drive:17SVY1L0VJ_7Q6ROY5vidmLCMUuXxNzfH","title":"Rosemary Violet Home"},{"kind":"page","parent_id":"witness:home-grows-open-001:small-things-grow","title":"Fidelity Friday — Small Things Grow"},{"kind":"page","parent_id":"witness:home-grows-open-001:last-light-open-circuit","title":"Last Light / Open Circuit"},{"kind":"candidate","parent_id":"witness:home-grows-open-001:remix-candidate","title":"HOME GROWS OPEN remix candidate"}],"LOSS":["descendant order preserves no source adjacency unless explicitly declared by neighboring slots"],"OUTPUT":{"candidate_id":"manga-sequence:ad8b69b2fa56d8cf7b8a9a589411c5a393f44e83dc416a47cf5875ef8340a4ee","schema":"lemonpress/manga-sequence-candidate/v0","sequence_sha256":"787abf611522fbf821c14f3294900b81395f14f112d5ba834f1fe7a7f01de08c"},"RESIDUAL":"all parent particulars remain unchanged and independently addressable","STOP":"candidate only; explicit local selection/admission required before becoming issue/page authority","TRANSFORMATION":"declared reading-order remix with slot-preserving sequence","UNKNOWN":["publication status","canon status","issue admission status"]}}
